{
  "schema": "raw.v0",
  "venue_id": "polymarket",
  "stream": "orderbook",
  "instrument_native": "0x12345abcdef...",
  "partition_key": "polymarket_orderbook_0x12345abcdef",
  "ts_event_ms": 1758763048123,
  "ts_ingest_ms": 1758763048125,
  "is_historical": false,
  "payload": {
    "market_id": "0x12345abcdef...",
    "event_type": "book_update",
    "timestamp": 1758763048123,
    "bids": [
      {"price": "0.63", "size": "1000.0"},
      {"price": "0.62", "size": "500.0"}
    ],
    "asks": [
      {"price": "0.64", "size": "800.0"},
      {"price": "0.65", "size": "1200.0"}
    ]
  }
}